{
  "schema": "lifecycle-estate/v2",
  "keys": ["device:device-a"],
  "updated_at": "2026-09-07T00:00:00Z",
  "source_agent": "modernization-analysis",
  "status": "stale",
  "headline": "Estate is one SoT group with no vendor research yet — not a buy list.",
  "next_action": "Run the Modernization Lifecycle check only.",
  "dispatched": [],
  "coverage": {
    "item_count": 1,
    "with_eox": 0,
    "with_psirt": 0,
    "with_cost": 0,
    "with_software": 0
  },
  "recommendations": [],
  "guidance": {
    "updated_at": "2026-09-07T00:00:00Z",
    "identity_confidence": "medium",
    "research_confidence": "stale",
    "objectives_status": "missing",
    "understood": "Shape only — one product group from SoT; research not filled.",
    "answers": "",
    "open_asks": []
  },
  "assessment": {
    "must_move": [],
    "can_wait": ["cat8000v: research missing — not a hardware buy until Cisco columns exist"],
    "contradictions": [],
    "opinion": "Estate is one SoT group with no vendor research yet — not a buy list."
  },
  "plan": {
    "status": "none",
    "cost": {
      "currency": null,
      "list_total": null,
      "priced_qty": 0,
      "unpriced_qty": 1,
      "notes": "No CCW prices on disk."
    },
    "timeline": [],
    "opinion": "No plan invoke — sequence waits on research and operator answers."
  },
  "roadmap_ref": null,
  "items": [
    {
      "pid": "cat8000v",
      "pid_source": "device_type",
      "quantity": 1,
      "devices": ["device-a"],
      "roles": [],
      "platforms": ["cat8000v"],
      "software_versions": [],
      "sample_device": "device-a",
      "summary": "One product group from SoT device_type.",
      "source": {
        "kind": "inventory",
        "reliability": "medium",
        "ref": "inventory/infra-sot.json"
      },
      "recommended_replacement": null,
      "selected_replacement": null,
      "selected_replacement_source": null,
      "replacement_family": null,
      "replacement_candidates": [],
      "replacement_ask": null,
      "recommended_software": null,
      "list_cost_per_unit": null,
      "total_list_cost": null,
      "currency": null,
      "end_of_sale": null,
      "end_of_support": null,
      "end_of_software_support": null,
      "end_of_security_vuln_support": null,
      "vulnerabilities": [],
      "psirts": [],
      "detail_ref": "inventory/assets/cat8000v.json",
      "updated_at": "2026-09-07T00:00:00Z",
      "expires_at": null,
      "research": {
        "eox": "missing",
        "software": "skipped",
        "psirt": "missing",
        "ccw": "skipped",
        "nvd": "missing"
      }
    }
  ]
}
